{
  "contract": "hel.event",
  "contract_version": "1.0",
  "event_id": "PF_2003",
  "luminous_end": {
    "time_utc": "2003-03-27T05:50:26.4Z",
    "lat": 41.46,
    "lon": -87.73,
    "altitude_m": 18000.0,
    "terminus_speed_mps": 3000.0,
    "azimuth_deg": 21.0,
    "declination_deg": 61.0
  }
}
