{
  "contract": "hel.event",
  "contract_version": "1.0",
  "event_id": "HB_2018",
  "luminous_end": {
    "time_utc": "2018-01-17T01:08:34Z",
    "lat": 42.451,
    "lon": -83.857,
    "altitude_m": 19730.0,
    "terminus_speed_mps": 3000.0,
    "azimuth_deg": 301.56,
    "declination_deg": 66.14
  }
}
